,tweetid,user,content,date,lang,sentiment
581,816511727604895745,482406912,"Tengo mi lado lindo y mi lado culero, pero bien culero.",Wed Jan 04 05:09:00 +0000 2017,es,N
582,816511244504952832,418034633,"Mi celular sabe que soy mexicano, escribí white y me lo corrigió por ejote",Wed Jan 04 05:07:05 +0000 2017,es,NEU
583,816510954028535809,65789674,Acabo de etiquetar a mi tía en una cosa. Soy más allá de mi propia tía. Soy la tía de las tías.,Wed Jan 04 05:05:56 +0000 2017,es,P
584,816545570382815232,290628833,"Como cuando duermo de día y de noche ando bien pilas, esto es fantástico",Wed Jan 04 07:23:29 +0000 2017,es,N
585,816544673330184192,142829520,"#quierounanovia no gracias, soy homosexual.",Wed Jan 04 07:19:55 +0000 2017,es,NEU
586,816569028013686785,763400497017475076,"Mi sueño no es tan imposible, tan solo es viajar a Canadá yo sé que puedo lograrlo",Wed Jan 04 08:56:42 +0000 2017,es,P
587,816539395243311104,163130669,Quiero ser flaca y bonita,Wed Jan 04 06:58:57 +0000 2017,es,NONE
588,816524460916293632,105220848,"@LuceroGama tu foto de perfil me trae recuerdos, extraño escucharte",Wed Jan 04 05:59:36 +0000 2017,es,N
589,816552888214417412,145483586,"Esta vez que tengo todo para ir , no estoy tan segura jajaj",Wed Jan 04 07:52:34 +0000 2017,es,P
590,816277829516165120,268413862,"@Fridaricky así como estas... Primero abajo, pero comiendo panochita suave, y luego atrás para dejarte la ir muy duro! Qué rico",Tue Jan 03 13:39:34 +0000 2017,es,P
591,816275876882976769,298220255,"Mames, hoy si me dio frío",Tue Jan 03 13:31:49 +0000 2017,es,N
592,816269451150528512,2355687841,"@sapitomen de me ntojaban más unos de canasta. Jijiji háblame de tú, porfa",Tue Jan 03 13:06:17 +0000 2017,es,P
593,816290273957388288,158983852,Ser feliz no significa que todo es perfecto. ... Buen día a todos!,Tue Jan 03 14:29:01 +0000 2017,es,P
594,816287129823154176,83396681,Pues empecé mi día con el pie derecho... metido en un monte de tierra por las reparaciones de las calles,Tue Jan 03 14:16:32 +0000 2017,es,N
595,816290106575159296,102812491,@RociYAxel Feliz cumpleaños que la pases súper bien,Tue Jan 03 14:28:22 +0000 2017,es,P
596,816310241256177664,746042431859130368,¡HAZ EN GRANDE TUS PROPÓSITOS PARA ESTE AÑO! LAR Inmobiliaria les desea un feliz año 2017 #LARinmobiliaria,Tue Jan 03 15:48:22 +0000 2017,es,P
597,816309607119388673,144726280,"y así, con tu gran ocico cerrado es como te ves más o menos bonita",Tue Jan 03 15:45:51 +0000 2017,es,N
598,816292744754642945,214880865,@RAMMS09 amigo como estas ? Buenos días perdón ayer me fui a dormir,Tue Jan 03 14:38:50 +0000 2017,es,NEU
599,816282488330928128,41893527,"@David17519416 Pero no hicimos rolas por años, solo ligamos bandas y canciones en común Gracias por escuchar",Tue Jan 03 13:58:05 +0000 2017,es,P
600,816296748054413312,174490565,"@bucio_lesly acabo de ver algo similar y te juro que sentí bien feo, ojalá nunca tenga que verme en la necesidad",Tue Jan 03 14:54:45 +0000 2017,es,N
601,816310851724513280,4307819534,En serio tengo muchas ganas de verte Te extraño demasiadoo..!,Tue Jan 03 15:50:48 +0000 2017,es,N
602,816413853194055680,93341904,"@SoyTanNinaBien jaja, estás aburrida!? Mejor cuéntanos otro cuento",Tue Jan 03 22:40:05 +0000 2017,es,N
603,816426144862011392,83762926,"@_alineepa exacto, no va a pasar!! Pero cada quien puede y debe hacer su parte",Tue Jan 03 23:28:56 +0000 2017,es,NEU
604,816448334135181312,82211829,"@darkanhell son previsores, es por si algún día llega un auto por allá ok, no...",Wed Jan 04 00:57:06 +0000 2017,es,NONE
605,816448200882143233,123457550,Estoy comenzando la última temporada de HIMYM,Wed Jan 04 00:56:34 +0000 2017,es,NONE
606,816461396049272833,19056748,@szerenata toda la suerte del mundo en tu nuevo proyecto /espacio / hora . Te quiero mucho amiga mía . #mty #orgullo,Wed Jan 04 01:49:00 +0000 2017,es,P
607,816463282034933760,14739100,"@bayou7478 estoy igual. Quiero un maratón en marzo/abril y otro en octubre/noviembre. Si te enteras de nos buenos, por favor avisa.",Wed Jan 04 01:56:30 +0000 2017,es,P
608,816319281767981057,15395383,"@vcatita al contrario, me creo poco porque según mi ""couchhhhhh"" ya debo de hacer 6k",Tue Jan 03 16:24:17 +0000 2017,es,P
609,816318304818118656,453262627,@Miamanta buenos días sam ya aquí estamos después de estar un poco enfermo pero ya vamos mejorando saludos y feliz año y bendiciones,Tue Jan 03 16:20:24 +0000 2017,es,P
610,816317725253332992,1855630826,Pinche equipo me ilusiona bien machín para este año @Cruz_Azul_FC,Tue Jan 03 16:18:06 +0000 2017,es,P
611,816168730682081280,26503978,"@AlbertoMoolina sobres, yo llevo los juegos de azar. Tu completa lo demás",Tue Jan 03 06:26:03 +0000 2017,es,NONE
612,816167151874768896,363969756,Y la segunda en brillas más es Venus,Tue Jan 03 06:19:47 +0000 2017,es,NONE
613,816333644302123008,3169085491,"@J_Pietra Me gustaria conoserte Y estar 1 dia contigo y con todo el plantel de chivas,me gustas como narra pero como nunca me aras caso",Tue Jan 03 17:21:22 +0000 2017,es,P
614,816339796834385920,3607243459,"#QueNoSePierdaLaCostumbre De Querernos, amarnos, respetarnos, cuidarnos y estar juntos toda la vida",Tue Jan 03 17:45:49 +0000 2017,es,N
615,816338875802976257,3607243459,@adriantr09 @ClubTiburones @PumasMX Ya rugiste León Ya estufas,Tue Jan 03 17:42:09 +0000 2017,es,NONE
616,816341623147663360,3607243459,"#EnEneroYo estaré más al pendiente de mi familia, mis fans y estaré al pendiente de sus mensajes pequeños amores",Tue Jan 03 17:53:04 +0000 2017,es,P
617,816312592884846592,68180039,"Aparentemente superados los efectos de la venganza de Moctezuma, cogemos camino a Chiapas ... porque mucha historia nunca es suficiente",Tue Jan 03 15:57:43 +0000 2017,es,P
618,816224562052472832,169215813,Tan sabroso que estaba durmiendo,Tue Jan 03 10:07:54 +0000 2017,es,N
619,816302931167367168,80978322,@faustoponce @ivoox Ok. Gracias. Ten un buen día.,Tue Jan 03 15:19:19 +0000 2017,es,P
620,816300769272008704,1003260295,"Mi gata es tan desconciderada, pasa sus pequeños bigotes en mi cara para que despierte",Tue Jan 03 15:10:44 +0000 2017,es,N
621,816320275461632000,16429897,@KoenmaJr20 probando nuevos Morning show! @ExaFM me aburre ya! Se ha vuelto demasiado tonto el programa! Extraño a @Cecidelacueva,Tue Jan 03 16:28:14 +0000 2017,es,N
622,816319498827481088,286837687,Por lo regular lo primero que digo al despertarme es perdón me quede dormida o ya se me hizo tarde,Tue Jan 03 16:25:09 +0000 2017,es,N
623,816307871075868672,47815762,Tal vez estoy pagando algún tipo de karma por no hacerle caso al carnicero de por mi trabajo… siempre me dice que me veo bonita,Tue Jan 03 15:38:57 +0000 2017,es,NEU
624,816307446180380672,2669363616,"@DhasiaWezka yo creo que seria muy bonito entrar a tu tw y ver ese ""Te sigue""",Tue Jan 03 15:37:16 +0000 2017,es,P
625,816305713521823744,112882465,@libertadzavala ¡Gracias por las flores! Ha sido gracias al esfuerzo de un gran equipo @annabrays @bikennia @ClaraVadillo @YazAPie y más,Tue Jan 03 15:30:22 +0000 2017,es,P
626,816303293458620417,2256008366,Buen día. No funciona el semáforo de Avenida Cultura @HermosilloGob Saludos,Tue Jan 03 15:20:45 +0000 2017,es,N
627,816324771935879168,153495267,Tengo un buen de ganas de ir al cine pero soy tan flojo,Tue Jan 03 16:46:06 +0000 2017,es,N
628,816323110345375744,2821154495,Nota mental: no le quieras ayudar a alguien que no confía en ti. -La primer enseñanza de este año-,Tue Jan 03 16:39:30 +0000 2017,es,N
629,816321974515286016,1276473565,Adiós a la nueva planta de #Ford en #México,Tue Jan 03 16:34:59 +0000 2017,es,N
630,816327303751995392,93341904,"@Filibrown jajajajajaja. De todos esos nomás rebozos merco, jajaja. Mi troca es tailandesa no la han traído a silao uu",Tue Jan 03 16:56:10 +0000 2017,es,NONE
631,816297623837548544,355298423,"@LilieMayen es en Marzo, ¿no? es que voy a ir con mi novia",Tue Jan 03 14:58:14 +0000 2017,es,N
632,816668898770714626,2830192332,@pabloalboran eyyy regresa yaa!!! Tu @FamAlboranMex te espera,Wed Jan 04 15:33:33 +0000 2017,es,N
633,816763078733746176,145420282,@correosdemexico está atascado el palacio de los deseos @L_ArellanoN #Ayñ #NoVanALlegarLosReyes,Wed Jan 04 21:47:47 +0000 2017,es,N
634,816755902103568388,53147384,"Ya hasta me duele la cabeza. Mañana/tarde pesada, pesadísima en la oficina.",Wed Jan 04 21:19:16 +0000 2017,es,N
635,816779482291912704,21735173,@nilomandeDior Hoy estuve viendo muchas fotos dell Escuadrón. Lo extraño,Wed Jan 04 22:52:58 +0000 2017,es,N
636,816444386464698369,53147384,@marianaequi ¡Vientos! Va sanando bien chido. ¡Cuídate mucho esa manita!,Wed Jan 04 00:41:25 +0000 2017,es,P
637,816458320559144961,445725301,Fue MEJOR que algunas personas se fueran para conocer a otras,Wed Jan 04 01:36:47 +0000 2017,es,P
638,816407909353529344,523745106,"@EddGZ Neel, eso no me gusta, mejor tú y el día que sea, por la tarde, y busco adaptarme",Tue Jan 03 22:16:28 +0000 2017,es,NEU
639,816369822242107392,201420237,"@ivonnems28 ¿crees? Hahaha obvio si, todos toditos, de todas toditas las personas",Tue Jan 03 19:45:07 +0000 2017,es,N
640,816369591182131201,95266265,No sabía que el ser humano fuese capaz de producir tanto moco verde. Hasta ahora. #GanandoComoSiempre,Tue Jan 03 19:44:12 +0000 2017,es,N
641,816449825323372544,863406444,@CristinaEnAlfa @alfa913fm Hola Cris Saludos desde Ahome Sinaloa rumbo a Tijuana en un autobús Elite Hermosa,Wed Jan 04 01:03:01 +0000 2017,es,NONE
642,816449753135255552,278147534,@TarsisLugo si no te gusta ponle limón y azúcar así sabe más rica,Wed Jan 04 01:02:44 +0000 2017,es,P
643,816459926654439428,102812491,La verdad hoy fue una noche bastante aburrida espero poder salir mañana,Wed Jan 04 01:43:10 +0000 2017,es,N
644,816477717050916865,40487039,"En verdad necesito un celular nuevo, no lo quiero, lo necesito. se trababa hasta para respirar",Wed Jan 04 02:53:51 +0000 2017,es,N
645,816476446990311424,101567080,Esos taquitos al pastor me están destrozando el estomago peor que tus engaños,Wed Jan 04 02:48:49 +0000 2017,es,N
646,816632751642251264,481472725,"Desvelado, cansado, cuasienfermo pero feliz. Vámonos al aeropuerto. Buenos días!",Wed Jan 04 13:09:54 +0000 2017,es,NEU
647,816632674353901568,132254421,Buenos días Pues vamos a empezar a darle a esto!!! Ahora va la mía Y q venga todo con mucha candela!,Wed Jan 04 13:09:36 +0000 2017,es,P
648,816652657792159746,126191730,Ya no logré mi propósito de ser más puntual. Voy a tener que esperar hasta el 2018.,Wed Jan 04 14:29:00 +0000 2017,es,N
649,816666903083122689,184850544,@ICVNL ustedes me puede ayudar a saber pq voy a pagar mas que en los anios anteriores,Wed Jan 04 15:25:37 +0000 2017,es,N
650,816666323384238080,80774470,Ya extraño a mi mamá y todavia no me voy,Wed Jan 04 15:23:19 +0000 2017,es,N
651,816687131716239360,44606225,Feliz día del periodista !! A mis conocidos amigos y gente que sigo y me sigue,Wed Jan 04 16:46:00 +0000 2017,es,P
652,816686936261795840,57687280,"Que pinche chiste tiene estar ""medio alto"" si todos aquí están bien pigmeos",Wed Jan 04 16:45:13 +0000 2017,es,N
653,816689576962129920,62942058,MELCHOR GASPAR Y yo sin quincena,Wed Jan 04 16:55:43 +0000 2017,es,N
654,816688976123850753,117810810,Eso de salir a las 8 de la escuela no va a estar chido,Wed Jan 04 16:53:19 +0000 2017,es,N
655,816660139541491713,149955893,@GenariuxR Buenos y bonitos dias amiwoooooooooo,Wed Jan 04 14:58:44 +0000 2017,es,P
656,816619005888884736,14346090,"Qué bonito que ""In to my Arms"" sea la segunda canción escuchada este día.",Wed Jan 04 12:15:17 +0000 2017,es,P
657,816676970029150208,888888452,"@NayadeAbsal Huy ps así que chiste?, no seria tan divertida la vida",Wed Jan 04 16:05:37 +0000 2017,es,N
658,816680404438630405,85247427,@Jimmy_Jammes Vi que empezaste el año con empleo nuevo. Un gran abrazo. Un súper gusto conocerte. Éxito.,Wed Jan 04 16:19:16 +0000 2017,es,P
659,816679712676347908,983578850,"Al esperar ese mensaje Se decide cual será mi siguiente paso en el destino!,, que nervios",Wed Jan 04 16:16:31 +0000 2017,es,NEU
660,816679186777550848,62653950,@MemoCalderonS feliz año tu! Tenía un rato de no saludar. Un abrazo,Wed Jan 04 16:14:25 +0000 2017,es,P
661,816677587481141248,133018149,Mierda porque es tan difícil decidir en que casa vivir? Hay pros y contras en cada una,Wed Jan 04 16:08:04 +0000 2017,es,N
662,816698997674889217,164572908,A veces siento que es mejor estar atrás de un escritorio que intentarle a la litigada,Wed Jan 04 17:33:09 +0000 2017,es,NEU
663,816701833175449604,3607243459,"#MiPropositoEs Seguir siendo la mejor madre y la mejor periodista, cumplirles sus sueños a todos mis seguidores y ser mejor persona",Wed Jan 04 17:44:25 +0000 2017,es,P
664,816701649796239360,3607243459,"#PierdoMuchoTiempoEn Hacerle caso a los chismes, críticas, malos comentarios hacia mi persona Es mi vida, no la de ustedes",Wed Jan 04 17:43:41 +0000 2017,es,N
665,816700838823366656,3607243459,"#EsLaUltimaVezQueTeDigo Que lo que siento por ti, no lo siento por nadie más ¡ENTIÉNDELO CARAJO! Santiago Olavarría",Wed Jan 04 17:40:28 +0000 2017,es,N
666,816700634124554240,3607243459,Mis pequeños Amores no me van a felicitar Hoy es el #DiaDelPeriodista Ya 10 años dedicándome al Periodismo y los que me faltan,Wed Jan 04 17:39:39 +0000 2017,es,NEU
667,816700202983657472,3607243459,#FelizMiercoles Mis Chamacos Queridos Dios me los bendiga y me los llene de todo su amor los quiero Besitos,Wed Jan 04 17:37:56 +0000 2017,es,P
668,816699655278891008,3607243459,"@adriantr09 @ClubTiburones @PumasMX Siempre he sido así Y pues siempre he cumplido y pagado apuestas, así que ya rugiste león",Wed Jan 04 17:35:46 +0000 2017,es,P
669,816703766179086337,3607243459,"10 AÑOS DEDICÁNDOME AL PERIODISMO, Y LOS QUE ME FALTAN POR CUMPLIR 6 años en la F1 & UFC",Wed Jan 04 17:52:06 +0000 2017,es,P
670,816528339389267968,96405403,necesito nuevo dealer éste cuatri será difícil si no dejo mi vida en manos de la bendita drogadicción,Wed Jan 04 06:15:01 +0000 2017,es,N
671,816528280996237313,199807983,Sabes que ya estás viejo cuando tus primos quieren ver pelis toda la noche y tu solo quieres dormir ya,Wed Jan 04 06:14:47 +0000 2017,es,N
672,816528104759775232,2245014654,Creo que no enseñan griego en el departamento de lenguas extranjeras,Wed Jan 04 06:14:05 +0000 2017,es,NONE
673,816527530941239296,105533964,"@noelvalenzuelap we yo también me aventé una season de una seria así !! Va, llega temprano tengo ganas de verte",Wed Jan 04 06:11:48 +0000 2017,es,P
674,816527112169353216,102812491,"A esta hora Twitter esta lleno de gente sentimental, que no puede dormir y que se siente de la mierda que pasa aqui diablos",Wed Jan 04 06:10:08 +0000 2017,es,N
675,816526155721359360,62854190,"@DebnamFabray si, la verdad si fue feo",Wed Jan 04 06:06:20 +0000 2017,es,N
676,816561144529907713,481472725,Ya cayó la segunda parte del pavo cachetón,Wed Jan 04 08:25:22 +0000 2017,es,NONE
677,816557392078852096,778774826534080512,Estoy esperando aún el directo de @ZooEvolution @WillyrexYT @vegetta777,Wed Jan 04 08:10:27 +0000 2017,es,NONE
678,816514316572774402,168789452,#Stop. Dios es bueno en todo tiempo,Wed Jan 04 05:19:17 +0000 2017,es,P
679,816746555298484226,533870277,Jajajajaja ay que triste me siento,Wed Jan 04 20:42:07 +0000 2017,es,N
680,816748405577891840,88686025,@szurita ya estuvo que el mexicano se quedó preso la Lic @ruizmassieu ya no es la mera! Mera ahora es Videgaray,Wed Jan 04 20:49:28 +0000 2017,es,NONE
681,816747206635966464,157355370,"Hoy hace 4 años, grabamos mi primer sencillo. #UltimoAire Gracias a todos los que han estado conmigo siempre",Wed Jan 04 20:44:43 +0000 2017,es,P
682,816738498095050752,109165393,"@TuiteroRegio @Bomborisimo Jajajajajajajaj ya están peor que Peña, puro atole con el dedo a los tuiteros",Wed Jan 04 20:10:06 +0000 2017,es,N
683,816765176829591552,196359724,Soñé que tenía una banda de Rock céltico.,Wed Jan 04 21:56:07 +0000 2017,es,P
684,816763931301658627,174490565,"Jamás imaginé que estar incapacitada lo disfrutaría tanto, después de todo no me fue mal",Wed Jan 04 21:51:10 +0000 2017,es,NEU
685,816735670886612992,1350171512,"#Gasolinazo tema para ubicar nuestra realidad nacional, hasta el jefe nos pide nuestro punto de vista #horasad",Wed Jan 04 19:58:52 +0000 2017,es,N
686,816735564632203264,825717716,mamá quiero ir a pp hoy ya no seas así,Wed Jan 04 19:58:27 +0000 2017,es,N
687,816694682545770496,360069044,Como cuando la persona siempre está cansada para todo menos para salir con alguien más.,Wed Jan 04 17:16:00 +0000 2017,es,N
688,816710214770536448,215790654,"@Sara_G2 jajajaja es súper buen pedo, te va a caer bien. Yo tampoco sé con quién me toca",Wed Jan 04 18:17:43 +0000 2017,es,P
689,816715733342109696,2877223750,"Confieso que tengo una play list en Spotify que dice : «Canciones para Bangtan » , son canciones cursis y una que otra loca",Wed Jan 04 18:39:39 +0000 2017,es,P
690,816706086828965895,3158886781,@darkomacedo seee eso está bien pinche triste,Wed Jan 04 18:01:19 +0000 2017,es,N
691,817393151115689985,71470080,@Eudemonologia87 yo igual y ni así. Este año seré tipo marasalvatrucha para ver si así me traen algo.,Fri Jan 06 15:31:28 +0000 2017,es,N
692,817469764645830659,3607243459,@Pagano656 #NoaNoaStyle es uno de los mejores luchadores que ha llegado a @luchalibreaaa Yo tengo el gusto de seguirlo hace 4 años,Fri Jan 06 20:35:54 +0000 2017,es,P
693,817365568051445761,344898157,Primer logro del año cumplido. Me agregaron al grupo de desayunos de mi trabajo #AquiEstaTuGordoBabyMyLove,Fri Jan 06 13:41:51 +0000 2017,es,P
694,817451249478103045,455510766,@jenifersaucedo_ así es Pero somos mas personas honradas! Que se note,Fri Jan 06 19:22:20 +0000 2017,es,P
695,817473237923659777,1114946798,@puntoguionpunto ando bien porque nunca sentí nada. Pero estaban bien ricos porque tenían chispitas.,Fri Jan 06 20:49:42 +0000 2017,es,P
696,817472709651296257,3607243459,@GarzaaJr No es un bulto y nunca lo ha sido @GarzaaJr es un luchador Novato que ha madurado muchísimo desde que llegó a @luchalibreaaa,Fri Jan 06 20:47:36 +0000 2017,es,N
697,817450350798077952,906973404,"@ErickCt_ nosotros estábamos muy feliz mente cazando pokemon, siguiendo nueStra ruta y tuvimos un encuentro desafortunado",Fri Jan 06 19:18:45 +0000 2017,es,NEU
698,817449734206062594,18725474,"Parada obligada en pits y al banco.. Rumbo a Pueblo frío.. Hay q ir por la patrona, se acabaron las vacaciones",Fri Jan 06 19:16:18 +0000 2017,es,N
699,817449069568294912,616590372,No me parece justo que ya sea 6 y yo no haya comido ni un poco de rosca,Fri Jan 06 19:13:40 +0000 2017,es,N
700,817447576630796289,429626776,Cuándo se termine este contrato empezaré a buscar un nuevo depa y un gatito.,Fri Jan 06 19:07:44 +0000 2017,es,P
701,817446974651846657,196811798,@ChulasDeJA @julionalvarez @EEnrique_F @NoticiasJulion hermosa nosotros somos una estacion de musica tropical,Fri Jan 06 19:05:20 +0000 2017,es,NONE
702,817446852060741634,71096386,@andreaamena es que si te pasas de guapa andy,Fri Jan 06 19:04:51 +0000 2017,es,P
703,817445493211103232,188798472,"@JenniferDuquee Hahaha, si está rico, nadamas le falta presentación.",Fri Jan 06 18:59:27 +0000 2017,es,NEU
704,817445366928838656,127241236,"La peor noche, no se como pude dormir así de enferma",Fri Jan 06 18:58:57 +0000 2017,es,N
705,817475027155255304,2590754040,Me quede vestida y alborotada.,Fri Jan 06 20:56:49 +0000 2017,es,N
706,817474337292906500,458266453,Amo las mujeres que manejan estándar,Fri Jan 06 20:54:04 +0000 2017,es,P
707,817373601649328130,102889798,"@JcAgmty es posible que baje la gasolina, los impuestos, el dolar y la canasta?plis jajaja",Fri Jan 06 14:13:47 +0000 2017,es,N
708,817371642817089536,1474562208,Que oso que soy tan chillona y no me puedo callar y el sr de al lado en el avión nomás no me abraza,Fri Jan 06 14:06:00 +0000 2017,es,N
709,817443072204218368,268413862,@mabonitatuya1 @Samemo11 Huy qué rico! Se ve que si te exitabas jeje,Fri Jan 06 18:49:50 +0000 2017,es,P
710,817428580971859968,2997104405,Si te encontrará tras cien años encontraré tus ojos negros entre millones de ojos negros,Fri Jan 06 17:52:15 +0000 2017,es,P
711,817428432560615424,742764461321129984,"Despidiendo a Pau en el aeropuerto. Ya se va a Monterrey, Nuevo León.",Fri Jan 06 17:51:40 +0000 2017,es,NONE
712,817425904175611905,395805068,"No me gusta mi nuevo lugar, estoy con chavos de FCA pero extraño a mi departamento T.T",Fri Jan 06 17:41:37 +0000 2017,es,N
713,817425698168061952,108471593,@ajuangorena igual que yo jajaja ya mero,Fri Jan 06 17:40:48 +0000 2017,es,NONE
714,817417322382102528,335556079,Que triste que Guadalajara está igual de contaminado que Mty,Fri Jan 06 17:07:31 +0000 2017,es,N
715,817422655716466689,1158380762,@LezlyCarolinaM que bonito cuando tienes novio jajajajaja,Fri Jan 06 17:28:42 +0000 2017,es,P
716,817416714874920961,4477120994,"Viendo ""Bichos"" y pensar que es todo lo que pasa en el país a pequeña escala",Fri Jan 06 17:05:06 +0000 2017,es,N
717,817415866707013632,1242931778,@yahirmusic ya estaba bien preparada para ir a verte hoy pero primero está la seguridad Espero que puedan reprogramarlo muy pronto,Fri Jan 06 17:01:44 +0000 2017,es,NEU
718,817423281435181056,1114946798,Los Reyes magos me trajeron una cruda que,Fri Jan 06 17:31:11 +0000 2017,es,N
719,817443649319407616,724069288357801984,@PPTeamKaren cuando hacen un helado galáctico,Fri Jan 06 18:52:08 +0000 2017,es,NONE
720,817485531265245186,126156314,Yo esperaba encontrar un boleto para ir al partido de mis Spurs vs Suns en la CDMX de bajo de mi arbolito,Fri Jan 06 21:38:33 +0000 2017,es,N
721,817485192306851843,3227574601,Estoy muy triste porque antes me llenaba con 2 pedazos de pizza y ahora con uno,Fri Jan 06 21:37:12 +0000 2017,es,N
722,817501797052989440,735889603,Puta gente naca por su culpa ya no me dejo mi mamá ir a partir rosca con mis amigos pónganse a trabajar,Fri Jan 06 22:43:11 +0000 2017,es,N
723,817500669015752704,147222772,"Tengo a un AMIGO que canta desafinadamente feliz, pero así lo quiero.",Fri Jan 06 22:38:42 +0000 2017,es,P
724,817500396818206720,145143835,@introvertchola @Rubestia @nuuzga que malos y yo ? yo tambien fui al carlssssssssss  #bitches,Fri Jan 06 22:37:37 +0000 2017,es,N
725,817502316072960002,23721988,@mayteaguirre ¡Cero! Lo que te haga feliz o te de tranquilidad está súper bien.,Fri Jan 06 22:45:15 +0000 2017,es,P
726,817494784755515393,126235772,"@olivanoticias ahí no van, por que no les gusta el sabor del jamón serrano",Fri Jan 06 22:15:19 +0000 2017,es,N
727,817494372589666304,374776054,@luisitorey #LuisitoReyMago pon dinámicas más difíciles en esta dinámica no se ven todos los comentarios,Fri Jan 06 22:13:41 +0000 2017,es,N
728,817505081708974082,149681381,"@Mariazelzel Tengo un mal presentimiento, Ojalá me equivoque, pero el equipo se debilitó.",Fri Jan 06 22:56:14 +0000 2017,es,N
729,817504807359578113,2305882076,Alguien quiere hablar conmigo por ft de audio ?? estoy en la escuela ya acabe todo y estoy muuuuuy aburrida,Fri Jan 06 22:55:09 +0000 2017,es,N
730,817475723401240578,587059807,"@Diablin13 Sigue pendiente de nuestras redes, estaremos regalando boletos para la premiere.",Fri Jan 06 20:59:35 +0000 2017,es,P
731,817475641855668224,172422234,A Certain Romance tiene una de mis frases favoritas!!!! Gracias @rominapons por esa #Rolota #ViernesConRomina,Fri Jan 06 20:59:15 +0000 2017,es,P
732,817475577955438593,346398669,Lo malo de ser flaco es que no puedo ir todos los días al gym.,Fri Jan 06 20:59:00 +0000 2017,es,N
733,817466372880027649,3607243459,#TotalmentePayaso @Psychooriginal uno de los mejores luchadores técnicos que he conocido Espero que salgas triunfador este año,Fri Jan 06 20:22:25 +0000 2017,es,P
734,817466071380803584,3607243459,El #NoaNoaStyle Es lo mejor que ha llegado a @luchalibreaaa @Pagano656 Enhorabuena #SinPayasoNoHayFiesta #ArrePapá,Fri Jan 06 20:21:13 +0000 2017,es,P
735,817465624502931456,166242968,@BearJhony Te portaste mal... que bueno ve por tus propios regalos y a tu gusto,Fri Jan 06 20:19:27 +0000 2017,es,P
736,817512660375916545,327158233,wawwwww siempre encuentro la modelo perfecta amo mi pasion de diseñar #javiercarbajaldiseñador #cdmx #atelierjaviercarbajal,Fri Jan 06 23:26:21 +0000 2017,es,P
737,817512330703568902,170077863,No hay nada más triste que terminas todas las temporadas de tu serie,Fri Jan 06 23:25:02 +0000 2017,es,N
738,817509053710614528,113463109,"@lajosa La tradicional #RoscaDeReyes de #BisquetsObregón tiene un gran sabor, visita tu unidad favorita. ¡Te esperamos!",Fri Jan 06 23:12:01 +0000 2017,es,P
739,817514608332341251,700914014562299904,"Cuando dices vida yo estaré contigo, tomas de mi mano y por dentro lloro aunque sea mentira me haces sentir viva",Fri Jan 06 23:34:05 +0000 2017,es,P
740,817513853965701121,825717716,"Btw me voy despertando, hola",Fri Jan 06 23:31:06 +0000 2017,es,NONE
741,817520349155889152,105664865,"-Mi amor, ¿me veo gorda con este vestido? -A ver, rueda un poquito a la izquierda. -",Fri Jan 06 23:56:54 +0000 2017,es,P
742,817519664691412993,31178037,"Perdí todos mis contactos del cel Si me tienes guardada, mándame un whatsapp con tu nombre para guardarte, please",Fri Jan 06 23:54:11 +0000 2017,es,N
743,817490411635605504,1009843813,Nadie sabía que los peluche no son peluche son Pérez luche,Fri Jan 06 21:57:57 +0000 2017,es,NONE
744,817435371013214208,345552153,"@Gloryagpem @karench0708 ayer andábamos por allá jaja, le diré que vayamos mañana a ver si me dejan gracias lindas",Fri Jan 06 18:19:14 +0000 2017,es,P
745,817434506974167040,585392427,"Es como si ya me hubiera ido a vivir sola,",Fri Jan 06 18:15:48 +0000 2017,es,NONE
